{
  "schemaVersion": 2,
  "format": "embeddedknowledge-references-v2",
  "lessonId": "PREM-QNT-009",
  "lessonVersion": "0.2.0",
  "sources": [
    {
      "id": "source-nist-dlmf-vectors",
      "type": "reference-work",
      "title": "NIST Digital Library of Mathematical Functions, Chapter 1, \u00a7\u00a71.2(v) and 1.6(i)",
      "creators": [
        "National Institute of Standards and Technology"
      ],
      "publisher": "National Institute of Standards and Technology",
      "issued": "2010",
      "url": "https://dlmf.nist.gov/1",
      "accessed": "2026-07-23",
      "version": "DLMF web edition accessed 2026-07-23",
      "locator": "\u00a71.2(v), especially equations 1.2.38\u20131.2.52: vectors, scalar products, Euclidean norm, normalization, Cauchy\u2013Schwarz equality, and triangle inequality; \u00a71.6(i), especially equations 1.6.1\u20131.6.6: three-dimensional components, unit vectors, dot product, norm, and angle",
      "license": "NIST public technical reference under NIST Copyrights & Disclaimers; third-party contributions and cited works excluded",
      "archivedUrl": null,
      "uses": [
        {
          "usageType": "factual-reference",
          "rightsBasis": "facts-only-original-expression",
          "rightsBasisEvidence": "Only standard vector definitions, relations, and inequalities are used. All explanations, contexts, examples, values, checks, and assessments are original."
        }
      ],
      "agentAccess": {
        "status": "checked-no-agent-restriction-found",
        "termsUrl": "https://www.nist.gov/copyrights-disclaimers",
        "checked": "2026-07-22",
        "notes": "NIST rights and public robots routes were checked before DLMF access; no source-specific agent restriction, login, paywall, or access-control barrier was found."
      }
    }
  ]
}
