{
  "schemaVersion": 2,
  "format": "embeddedknowledge-references-v2",
  "lessonId": "PREM-CHE-001",
  "lessonVersion": "0.0.0",
  "sources": [
    {
      "id": "source-openstax-chemistry",
      "type": "textbook",
      "title": "Chemistry 2e",
      "creators": ["OpenStax"],
      "publisher": "OpenStax, Rice University",
      "issued": "2019",
      "url": "https://openstax.org/details/books/chemistry-2e",
      "accessed": "2026-07-19",
      "version": "2e",
      "locator": "Acid-base equilibria chapters",
      "license": "CC BY-NC-SA 4.0 (OpenStax book page, retrieved 2026-07-19). NonCommercial/ShareAlike is incompatible with this pack's CC BY 4.0 corpus: cite and link, do not adapt into lesson prose.",
      "archivedUrl": "https://web.archive.org/web/20260714160846/https://openstax.org/details/books/chemistry-2e",
      "uses": [{
        "usageType": "factual-reference",
        "rightsBasis": "facts-only-original-expression",
        "rightsBasisEvidence": "The specimen independently states underlying chemistry facts and does not copy or adapt the source's prose, examples, questions, organization, or media."
      }],
      "agentAccess": {
        "status": "human-only",
        "termsUrl": "https://openstax.org/books/chemistry-2e/pages/preface",
        "checked": "2026-07-19",
        "notes": "The current source page prohibits ingestion into generative-AI offerings. Contributor agents must not open or process its substantive content; a human rights and academic reviewer must verify any retained citation."
      }
    },
    {
      "id": "source-iupac-gold-book",
      "type": "reference-work",
      "title": "Compendium of Chemical Terminology (the Gold Book)",
      "creators": ["International Union of Pure and Applied Chemistry"],
      "publisher": "IUPAC",
      "issued": null,
      "url": "https://goldbook.iupac.org/",
      "accessed": "2026-07-19",
      "version": "Online edition",
      "locator": "Acid and base terminology",
      "license": "CC BY-SA 4.0 for individual terms (goldbook.iupac.org, retrieved 2026-07-19). ShareAlike is incompatible with a CC BY 4.0 corpus: cite the term DOI, do not copy definition text.",
      "archivedUrl": "https://web.archive.org/web/20260713141015/https://goldbook.iupac.org/",
      "uses": [{
        "usageType": "factual-reference",
        "rightsBasis": "facts-only-original-expression",
        "rightsBasisEvidence": "The specimen uses independently written terminology explanations and does not reproduce or adapt the source's definition text, selection, or presentation."
      }],
      "agentAccess": {
        "status": "human-only",
        "termsUrl": "https://goldbook.iupac.org/",
        "checked": "2026-07-19",
        "notes": "Agent-ingestion permission was not established for this specimen, so contributor agents must treat the source as human-verification only."
      }
    }
  ]
}
