{
  "schemaVersion": 2,
  "format": "embeddedknowledge-references-v2",
  "lessonId": "PREM-SCI-011",
  "lessonVersion": "0.2.0",
  "sources": [
    {
      "id": "source-efsa-weight-evidence",
      "type": "guideline",
      "title": "Guidance on the use of the weight of evidence approach in scientific assessments",
      "creators": [
        "EFSA Scientific Committee"
      ],
      "publisher": "European Food Safety Authority",
      "issued": "2017-08-03",
      "url": "https://pmc.ncbi.nlm.nih.gov/articles/PMC7009893/",
      "accessed": "2026-07-21",
      "version": "EFSA Journal 15(8):e04971",
      "locator": "Abstract; sections 2.1, 2.5, 2.7, and 4; DOI 10.2903/j.efsa.2017.4971",
      "license": "CC BY-ND 4.0, as displayed in the PMC record. No source expression is adapted in this pack.",
      "archivedUrl": null,
      "uses": [
        {
          "usageType": "factual-reference",
          "rightsBasis": "facts-only-original-expression",
          "rightsBasisEvidence": "The lesson independently synthesizes the underlying framework and does not copy or adapt source prose, organization, examples, tables, figures, questions, or other expression."
        }
      ],
      "agentAccess": {
        "status": "checked-no-agent-restriction-found",
        "termsUrl": "https://www.ncbi.nlm.nih.gov/home/about/policies/",
        "checked": "2026-07-21",
        "notes": "NCBI usage policies and the public robots route were checked. Because general crawling of PMC article pages is disallowed, substantive verification used one public NCBI BioC API request, an allowed article API route, without login, paywall, bulk retrieval, or access-control bypass."
      }
    },
    {
      "id": "source-lawlor-triangulation",
      "type": "review",
      "title": "Triangulation in aetiological epidemiology",
      "creators": [
        "Debbie A. Lawlor",
        "Kate Tilling",
        "George Davey Smith"
      ],
      "publisher": "International Journal of Epidemiology, Oxford University Press",
      "issued": "2016-12",
      "url": "https://pmc.ncbi.nlm.nih.gov/articles/PMC5841843/",
      "accessed": "2026-07-21",
      "version": "45(6):1866-1886",
      "locator": "Abstract; Table 1; key messages; concluding remarks; DOI 10.1093/ije/dyw314",
      "license": "CC BY 4.0, as displayed in the PMC record.",
      "archivedUrl": null,
      "uses": [
        {
          "usageType": "factual-reference",
          "rightsBasis": "facts-only-original-expression",
          "rightsBasisEvidence": "The lesson uses the methodological facts as evidence but independently creates its wording, organization, examples, dependence maps, prompts, and assessment items."
        }
      ],
      "agentAccess": {
        "status": "checked-no-agent-restriction-found",
        "termsUrl": "https://www.ncbi.nlm.nih.gov/home/about/policies/",
        "checked": "2026-07-21",
        "notes": "NCBI usage policies and the public robots route were checked. Because general crawling of PMC article pages is disallowed, substantive verification used one public NCBI BioC API request, an allowed article API route, without login, paywall, bulk retrieval, or access-control bypass."
      }
    },
    {
      "id": "source-fda-ich-e9",
      "type": "guideline",
      "title": "E9 Statistical Principles for Clinical Trials",
      "creators": [
        "International Council for Harmonisation of Technical Requirements for Pharmaceuticals for Human Use",
        "U.S. Food and Drug Administration"
      ],
      "publisher": "U.S. Food and Drug Administration",
      "issued": "1998-09",
      "url": "https://www.fda.gov/media/71336/download",
      "accessed": "2026-07-21",
      "version": "ICH E9, final guidance",
      "locator": "Sections 2.3.1-2.3.2 on blinding and randomization; PDF pages 12-14",
      "license": "FDA website content is public domain unless otherwise noted under the FDA Website Policies; underlying ICH interests are respected. Use here is facts-only with no copied expression.",
      "archivedUrl": null,
      "uses": [
        {
          "usageType": "factual-reference",
          "rightsBasis": "facts-only-original-expression",
          "rightsBasisEvidence": "The lesson independently explains the functions and limits of randomization, blinding, protocol conduct, withdrawals, and missing outcomes without reproducing the guidance's wording, structure, examples, or tables."
        }
      ],
      "agentAccess": {
        "status": "checked-no-agent-restriction-found",
        "termsUrl": "https://www.fda.gov/about-fda/about-website/website-policies",
        "checked": "2026-07-21",
        "notes": "FDA Website Policies and robots rules were checked before the public final-guidance PDF was processed. No agent-ingestion prohibition applied to the route; access required no login, paywall, bulk retrieval, or control bypass."
      }
    },
    {
      "id": "source-iarc-preamble",
      "type": "official-standard",
      "title": "Preamble to the IARC Monographs",
      "creators": [
        "International Agency for Research on Cancer"
      ],
      "publisher": "International Agency for Research on Cancer, World Health Organization",
      "issued": "2019-01",
      "url": "https://monographs.iarc.who.int/wp-content/uploads/2019/07/Preamble-2019.pdf",
      "accessed": "2026-07-21",
      "version": "Amended January 2019",
      "locator": "Part A section 6; Part B sections 2-6, especially PDF pages 10-12, 18, 24-39",
      "license": "Copyright IARC/WHO 2019; IARC Publications Terms allow limited educational review. No source expression, table, or figure is reused or adapted.",
      "archivedUrl": null,
      "uses": [
        {
          "usageType": "factual-reference",
          "rightsBasis": "facts-only-original-expression",
          "rightsBasisEvidence": "The source is used to verify the existence, separate evaluation, integration, and stated limits of human, experimental-animal, and mechanistic evidence streams. All lesson language, examples, diagram, and assessments are independently created."
        }
      ],
      "agentAccess": {
        "status": "checked-no-agent-restriction-found",
        "termsUrl": "https://publications.iarc.who.int/Terms-Of-Use",
        "checked": "2026-07-21",
        "notes": "The IARC Publications Terms and the Monographs robots route were checked before substantive use. No term prohibited this limited agent-assisted educational factual review; the public PDF required no login, paywall, bulk retrieval, or access-control bypass."
      }
    }
  ]
}
