{
  "schemaVersion": 2,
  "format": "embeddedknowledge-references-v2",
  "lessonId": "PREM-SCI-006",
  "lessonVersion": "0.2.0",
  "sources": [
    {
      "id": "source-nist-operational-definition",
      "type": "other",
      "title": "A Framework for Research Inventory of Manufacturing Sustainability Assessment",
      "creators": [
        "Juyeon Lee",
        "Yung-Tsun T. Lee"
      ],
      "publisher": "National Institute of Standards and Technology",
      "issued": "2013",
      "url": "https://doi.org/10.6028/NIST.IR.7959",
      "accessed": "2026-07-21",
      "version": "NISTIR 7959; official NIST publication record",
      "locator": "Section 3.1, Requirements for Operational Definition, printed page 8",
      "license": "NIST public information; see Copyrights & Disclaimers",
      "archivedUrl": null,
      "uses": [
        {
          "usageType": "factual-reference",
          "rightsBasis": "facts-only-original-expression",
          "rightsBasisEvidence": "Used only to verify the general function and requirements of an operational definition; no source wording, manufacturing example, organization, figure, table, or assessment was copied or adapted."
        }
      ],
      "agentAccess": {
        "status": "checked-no-agent-restriction-found",
        "termsUrl": "https://www.nist.gov/copyrights-disclaimers",
        "checked": "2026-07-21",
        "notes": "The accountable run checked NIST's current copyright and disclaimer route before substantive access. NIST presents unmarked web information as public information, and no term prohibiting this limited agent reading was found. The DOI and official PDF were accessed with ordinary browser requests."
      }
    },
    {
      "id": "source-jcgm-vim",
      "type": "official-standard",
      "title": "International Vocabulary of Metrology\u2014Basic and General Concepts and Associated Terms (VIM), 3rd edition",
      "creators": [
        "Joint Committee for Guides in Metrology"
      ],
      "publisher": "Bureau International des Poids et Mesures",
      "issued": "2012",
      "url": "https://doi.org/10.59161/JCGM200-2012",
      "accessed": "2026-07-21",
      "version": "JCGM 200:2012; 2008 edition with minor corrections; Annotated VIM3 consulted for approved clarifications",
      "locator": "Entries 2.13\u20132.21, 2.24\u20132.26, 2.39, 2.41, and 2.45",
      "license": "CC BY 4.0 for BIPM website materials unless otherwise stated",
      "archivedUrl": null,
      "uses": [
        {
          "usageType": "factual-reference",
          "rightsBasis": "facts-only-original-expression",
          "rightsBasisEvidence": "Used to verify metrology concepts and boundaries for measurement error, precision, repeatability, reproducibility, calibration, traceability, accuracy, and validation; the lesson independently synthesizes wording, structure, examples, diagram, and tasks."
        }
      ],
      "agentAccess": {
        "status": "checked-no-agent-restriction-found",
        "termsUrl": "https://www.bipm.org/en/copyright",
        "checked": "2026-07-21",
        "notes": "The accountable run checked BIPM's Terms and Conditions of Use before opening the VIM entries. BIPM states an open-access policy and applies CC BY 4.0 to website materials unless otherwise stated; no agent-ingestion restriction was found. Only ordinary public pages and the DOI route were used."
      }
    },
    {
      "id": "source-nist-tn1297",
      "type": "guideline",
      "title": "Guidelines for Evaluating and Expressing the Uncertainty of NIST Measurement Results",
      "creators": [
        "Barry N. Taylor",
        "Chris E. Kuyatt"
      ],
      "publisher": "National Institute of Standards and Technology",
      "issued": "1994",
      "url": "https://www.nist.gov/pml/nist-technical-note-1297",
      "accessed": "2026-07-21",
      "version": "NIST Technical Note 1297, 1994 edition; web version updated 2026-05-06",
      "locator": "Sections 3 and 5.2; Appendix D.1.1 terminology and correction guidance",
      "license": "NIST public information; see Copyrights & Disclaimers",
      "archivedUrl": null,
      "uses": [
        {
          "usageType": "factual-reference",
          "rightsBasis": "facts-only-original-expression",
          "rightsBasisEvidence": "Used only to verify statistical treatment of independent repeated observations, random and systematic effects, correction, and the need to address recognized systematic effects; no wording, example, table, or formula was copied."
        }
      ],
      "agentAccess": {
        "status": "checked-no-agent-restriction-found",
        "termsUrl": "https://www.nist.gov/copyrights-disclaimers",
        "checked": "2026-07-21",
        "notes": "The NIST copyright and disclaimer route was checked before substantive access. No term prohibiting limited agent reading was found. The public HTML technical-note sections were read using ordinary browser requests without login, bulk retrieval, or bypass."
      }
    },
    {
      "id": "source-testing-standards",
      "type": "official-standard",
      "title": "Standards for Educational and Psychological Testing",
      "creators": [
        "American Educational Research Association",
        "American Psychological Association",
        "National Council on Measurement in Education"
      ],
      "publisher": "American Educational Research Association",
      "issued": "2014",
      "url": "https://www.testingstandards.net/uploads/7/6/6/4/76643089/standards_2014edition.pdf",
      "accessed": "2026-07-21",
      "version": "2014 English edition; official open-access file",
      "locator": "Introduction; Chapter 1, Validity, printed pages 11\u201332; Chapter 2, Reliability/Precision and Errors of Measurement, printed pages 33\u201347; Chapter 3, Fairness in Testing, printed pages 49\u201372; glossary",
      "license": "Copyrighted official open-access edition; facts-only use in this lesson",
      "archivedUrl": null,
      "uses": [
        {
          "usageType": "factual-reference",
          "rightsBasis": "facts-only-original-expression",
          "rightsBasisEvidence": "Used only to verify validity as an evidence-based judgment about proposed interpretations and uses, relevant replication conditions, sources of construct-validity evidence, construct underrepresentation and irrelevant variance, and population/setting boundaries. No wording, examples, test content, tables, or organization were copied or adapted."
        }
      ],
      "agentAccess": {
        "status": "checked-no-agent-restriction-found",
        "termsUrl": "https://www.testingstandards.net/open-access-files.html",
        "checked": "2026-07-21",
        "notes": "Before substantive access, the accountable run searched the official site for current terms, copyright, robots, and AI-ingestion restrictions. No dedicated terms route or agent restriction surfaced; the official page explicitly provides the 2014 edition as open access. The public PDF was read through ordinary browser access. Open access was not treated as permission to reuse expression, and lesson use is facts-only original synthesis."
      }
    }
  ]
}
