{
  "schemaVersion": 2,
  "format": "embeddedknowledge-references-v2",
  "lessonId": "PREM-STA-002",
  "lessonVersion": "0.1.0",
  "sources": [
    {
      "id": "source-nist-histogram",
      "type": "reference-work",
      "title": "NIST/SEMATECH e-Handbook of Statistical Methods, section 1.3.3.14: Histogram",
      "creators": [
        "National Institute of Standards and Technology",
        "SEMATECH"
      ],
      "publisher": "National Institute of Standards and Technology, U.S. Department of Commerce",
      "issued": null,
      "url": "https://www.itl.nist.gov/div898/handbook/eda/section3/histogra.htm",
      "accessed": "2026-07-25",
      "version": "NIST/SEMATECH e-Handbook of Statistical Methods, online edition retrieved 2026-07-25; no publication or revision date is stated on the page",
      "locator": "Section 1.3.3.14, Histogram: purpose, definition, and questions the histogram answers",
      "license": "US Government work; NIST states that information on its sites is public information and may be distributed or copied, with credit requested",
      "archivedUrl": null,
      "uses": [
        {
          "usageType": "factual-reference",
          "rightsBasis": "facts-only-original-expression",
          "rightsBasisEvidence": "Used only for the facts that a histogram summarises the distribution of a univariate dataset and displays location, spread, skewness, outliers, and multiple modes; that it is built by splitting the range into equal-sized bins that the user may define arbitrarily or by rule; and that dividing bin counts by the number of observations gives bar heights that are the proportion of the data in each class. All wording, the cohort, the binning convention, and every example in this lesson are original. NIST copyright guidance at https://www.nist.gov/oism/copyrights states that NIST information is public information that may be distributed or copied and requests appropriate credit."
        }
      ],
      "agentAccess": {
        "status": "checked-no-agent-restriction-found",
        "termsUrl": "https://www.nist.gov/oism/copyrights",
        "checked": "2026-07-25",
        "notes": "Retrieved https://www.nist.gov/robots.txt on 2026-07-25; it disallows administrative and search paths only and places no restriction on /div898/. No terms-of-use clause prohibiting automated retrieval was found. The page was read directly rather than through a search summary."
      }
    },
    {
      "id": "source-nist-scatter",
      "type": "reference-work",
      "title": "NIST/SEMATECH e-Handbook of Statistical Methods, section 1.3.3.26: Scatter Plot",
      "creators": [
        "National Institute of Standards and Technology",
        "SEMATECH"
      ],
      "publisher": "National Institute of Standards and Technology, U.S. Department of Commerce",
      "issued": null,
      "url": "https://www.itl.nist.gov/div898/handbook/eda/section3/scatterp.htm",
      "accessed": "2026-07-25",
      "version": "NIST/SEMATECH e-Handbook of Statistical Methods, online edition retrieved 2026-07-25; no publication or revision date is stated on the page",
      "locator": "Section 1.3.3.26, Scatter Plot: purpose and the questions the scatter plot answers",
      "license": "US Government work; NIST states that information on its sites is public information and may be distributed or copied, with credit requested",
      "archivedUrl": null,
      "uses": [
        {
          "usageType": "factual-reference",
          "rightsBasis": "facts-only-original-expression",
          "rightsBasisEvidence": "Used only for the facts that a scatter plot checks for a relationship between two variables and is used to ask whether they are related, whether any relationship is linear or non-linear, whether the variation in one changes across values of the other, and whether outliers are present. The sixty paired values, the reading procedure, and the wording in this lesson are original. NIST copyright guidance at https://www.nist.gov/oism/copyrights states that NIST information is public information that may be distributed or copied and requests appropriate credit."
        }
      ],
      "agentAccess": {
        "status": "checked-no-agent-restriction-found",
        "termsUrl": "https://www.nist.gov/oism/copyrights",
        "checked": "2026-07-25",
        "notes": "Retrieved https://www.nist.gov/robots.txt on 2026-07-25; it disallows administrative and search paths only and places no restriction on /div898/. No terms-of-use clause prohibiting automated retrieval was found. The page was read directly rather than through a search summary."
      }
    },
    {
      "id": "source-af-charts",
      "type": "guideline",
      "title": "Data visualisation: charts",
      "creators": [
        "Government Analysis Function"
      ],
      "publisher": "Government Analysis Function, UK Government",
      "issued": "2022-05-19",
      "url": "https://analysisfunction.civilservice.gov.uk/policy-store/data-visualisation-charts/",
      "accessed": "2026-07-25",
      "version": "Published 2022-05-19; online version retrieved 2026-07-25",
      "locator": "Sections on choosing a chart type, bar charts and the numerical axis, and line charts",
      "license": "Open Government Licence v3.0",
      "archivedUrl": null,
      "uses": [
        {
          "usageType": "factual-reference",
          "rightsBasis": "facts-only-original-expression",
          "rightsBasisEvidence": "Used only for the facts that published guidance matches a display type to the statistical relationship being shown (bars for magnitude and ranking, lines for time series, scatterplots for correlation, maps for spatial patterns), that readers perceive bars as proportional to one another so breaking the numerical axis of a bar chart distorts those relative proportions and is advised against with an alternative display suggested instead, and that breaking the vertical axis of a line chart is treated as acceptable where needed. No wording, table, figure, or example from the guidance is reproduced; the teaching examples and all prose are original. The site's terms of use at https://analysisfunction.civilservice.gov.uk/terms-of-use/ place most content under the Open Government Licence v3.0 and separately withhold permission to reuse the site's images, so no image from the source is used or adapted."
        }
      ],
      "agentAccess": {
        "status": "checked-no-agent-restriction-found",
        "termsUrl": "https://analysisfunction.civilservice.gov.uk/terms-of-use/",
        "checked": "2026-07-25",
        "notes": "Retrieved https://analysisfunction.civilservice.gov.uk/robots.txt on 2026-07-25; it disallows only /wp-admin/ and places no restriction on the policy store. The terms of use prohibit attempts at unauthorised access but do not restrict ordinary automated retrieval of published pages. The page was read directly."
      }
    },
    {
      "id": "source-af-tables",
      "type": "guideline",
      "title": "Data visualisation: tables",
      "creators": [
        "Government Analysis Function"
      ],
      "publisher": "Government Analysis Function, UK Government",
      "issued": "2022-05-19",
      "url": "https://analysisfunction.civilservice.gov.uk/policy-store/data-visualisation-tables/",
      "accessed": "2026-07-25",
      "version": "Published 2022-05-19; online version retrieved 2026-07-25",
      "locator": "Section on when a demonstration table is useful",
      "license": "Open Government Licence v3.0",
      "archivedUrl": null,
      "uses": [
        {
          "usageType": "factual-reference",
          "rightsBasis": "facts-only-original-expression",
          "rightsBasisEvidence": "Used only for the facts that a table is recommended when readers need to compare values, read summary figures such as averages or totals, or handle quantities of very different sizes in one display, while charts are recommended for showing patterns, trends, and relationships. No wording, table layout, or example from the guidance is reproduced; the clinic and waiting-time tables in this lesson are original. Content is published under the Open Government Licence v3.0 per https://analysisfunction.civilservice.gov.uk/terms-of-use/."
        }
      ],
      "agentAccess": {
        "status": "checked-no-agent-restriction-found",
        "termsUrl": "https://analysisfunction.civilservice.gov.uk/terms-of-use/",
        "checked": "2026-07-25",
        "notes": "Retrieved https://analysisfunction.civilservice.gov.uk/robots.txt on 2026-07-25; it disallows only /wp-admin/ and places no restriction on the policy store. The page was read directly."
      }
    }
  ]
}
