{
  "schemaVersion": 2,
  "format": "embeddedknowledge-references-v2",
  "lessonId": "PREM-QNT-005",
  "lessonVersion": "0.2.0",
  "sources": [
    {
      "id": "source-nist-sp811-notation",
      "type": "official-standard",
      "title": "Guide for the Use of the International System of Units (SI), NIST Special Publication 811",
      "creators": [
        "Ambler Thompson",
        "Barry N. Taylor"
      ],
      "publisher": "National Institute of Standards and Technology",
      "issued": "2008",
      "url": "https://www.nist.gov/pml/special-publication-811/nist-guide-si-appendix-b-conversion-factors",
      "accessed": "2026-07-22",
      "version": "2008 edition; NIST web presentation updated 2025-08-18",
      "locator": "Appendix B.2, notation using powers of ten and E notation",
      "license": "NIST Technical Series work under NIST Copyrights & Disclaimers and technical-series licensing statements, subject to attribution and third-party exceptions",
      "archivedUrl": null,
      "uses": [
        {
          "usageType": "factual-reference",
          "rightsBasis": "facts-only-original-expression",
          "rightsBasisEvidence": "Only power-of-ten notation conventions are used. Every explanation, example, derivation, and assessment is original."
        }
      ],
      "agentAccess": {
        "status": "checked-no-agent-restriction-found",
        "termsUrl": "https://www.nist.gov/copyrights-disclaimers",
        "checked": "2026-07-22",
        "notes": "NIST rights, technical-series licensing, and robots routes were checked before access. No agent restriction, login, paywall, or access-control barrier was found."
      }
    },
    {
      "id": "source-nist-estimation",
      "type": "guideline",
      "title": "Everyday Estimation",
      "creators": [
        "National Institute of Standards and Technology, Office of Weights and Measures"
      ],
      "publisher": "National Institute of Standards and Technology",
      "issued": "2010-02-04",
      "url": "https://www.nist.gov/pml/owm/metric-si/everyday-estimation",
      "accessed": "2026-07-22",
      "version": "Web page updated 2025-08-27",
      "locator": "Opening discussion of magnitude, ordering, sensemaking, and reasonableness",
      "license": "NIST public information under the agency's Copyrights & Disclaimers statement; third-party items excluded",
      "archivedUrl": null,
      "uses": [
        {
          "usageType": "factual-reference",
          "rightsBasis": "facts-only-original-expression",
          "rightsBasisEvidence": "The lesson uses estimation's stated reasonableness role but creates all scale checks and teaching expression independently."
        }
      ],
      "agentAccess": {
        "status": "checked-no-agent-restriction-found",
        "termsUrl": "https://www.nist.gov/copyrights-disclaimers",
        "checked": "2026-07-22",
        "notes": "The public NIST rights and robots routes were checked before access; no agent restriction or access barrier was found."
      }
    },
    {
      "id": "source-nist-dlmf-powers",
      "type": "reference-work",
      "title": "NIST Digital Library of Mathematical Functions, Chapter 4: Elementary Functions",
      "creators": [
        "Ranjan Roy",
        "F. W. J. Olver"
      ],
      "publisher": "National Institute of Standards and Technology",
      "issued": "2026-06-15",
      "url": "https://dlmf.nist.gov/4",
      "accessed": "2026-07-24",
      "version": "Release 1.2.7",
      "locator": "Sections 4.2(iv) and 4.8(ii), especially equations 4.2.26\u20134.2.37 and 4.8.14\u20134.8.17",
      "license": "NIST DLMF copyright notice; copying is limited to research and teaching, and commercial reproduction is prohibited",
      "archivedUrl": null,
      "uses": [
        {
          "usageType": "factual-reference",
          "rightsBasis": "facts-only-original-expression",
          "rightsBasisEvidence": "Only power definitions, principal-value boundaries, and identities are used as factual support. The lesson derives and expresses its real-number treatment independently."
        }
      ],
      "agentAccess": {
        "status": "checked-no-agent-restriction-found",
        "termsUrl": "https://dlmf.nist.gov/about/notices",
        "checked": "2026-07-24",
        "notes": "The DLMF notice and NIST public access terms were checked before substantive use. No agent restriction, login, paywall, or access-control barrier was found; no bulk copying was performed."
      }
    }
  ]
}
