{
  "schemaVersion": 2,
  "format": "embeddedknowledge-references-v2",
  "lessonId": "PREM-LPP-002",
  "lessonVersion": "0.1.0",
  "sources": [
    {
      "id": "source-premed-syllabus",
      "type": "official-standard",
      "title": "Premed: Foundations for Medical Study",
      "creators": [
        "EmbeddedKnowledge"
      ],
      "publisher": "EmbeddedKnowledge",
      "issued": "2026-07-19",
      "url": "https://github.com/VSBDev/EmbeddedKnowledge/blob/76882799c7614eeb9307687bceab33896a79bb13/course/PREMED-SYLLABUS.md",
      "accessed": "2026-07-20",
      "version": "Curriculum version 1.0 candidate at repository commit 76882799c7614eeb9307687bceab33896a79bb13",
      "locator": "Sections 3.2, 4, 7, and 18",
      "license": "CC BY 4.0",
      "archivedUrl": null,
      "uses": [
        {
          "usageType": "factual-reference",
          "rightsBasis": "facts-only-original-expression",
          "rightsBasisEvidence": "Only curriculum facts and procedural relationships were used; all lesson prose, examples, tables, and assessment cases are independently authored."
        }
      ],
      "agentAccess": {
        "status": "checked-no-agent-restriction-found",
        "termsUrl": "https://embeddedknowledge.io/content-license.txt",
        "checked": "2026-07-20",
        "notes": "Public repository-owned source. Project instructions explicitly direct lesson agents to consult the syllabus, and no access control or agent-ingestion restriction was found for this use."
      }
    },
    {
      "id": "source-content-standard",
      "type": "official-standard",
      "title": "EmbeddedKnowledge Learning-Content Standard v1",
      "creators": [
        "EmbeddedKnowledge"
      ],
      "publisher": "EmbeddedKnowledge",
      "issued": null,
      "url": "https://github.com/VSBDev/EmbeddedKnowledge/blob/76882799c7614eeb9307687bceab33896a79bb13/CONTENT-STANDARD.md",
      "accessed": "2026-07-20",
      "version": "Version 1 at repository commit 76882799c7614eeb9307687bceab33896a79bb13",
      "locator": "Sections 2, 5.1, 6 through 8, and 13",
      "license": "CC BY 4.0",
      "archivedUrl": null,
      "uses": [
        {
          "usageType": "factual-reference",
          "rightsBasis": "facts-only-original-expression",
          "rightsBasisEvidence": "Only instructional design requirements and evidence conclusions were used; no wording, source example, question, or organization was copied or adapted."
        }
      ],
      "agentAccess": {
        "status": "checked-no-agent-restriction-found",
        "termsUrl": "https://embeddedknowledge.io/content-license.txt",
        "checked": "2026-07-20",
        "notes": "Public repository-owned source. The author skill requires agents to read it, and no access control or agent-ingestion restriction was found for this use."
      }
    },
    {
      "id": "source-authoring-evidence",
      "type": "review",
      "title": "Evidence synthesis: writing university-grade learning content",
      "creators": [
        "EmbeddedKnowledge"
      ],
      "publisher": "EmbeddedKnowledge",
      "issued": "2026-07-19",
      "url": "https://github.com/VSBDev/EmbeddedKnowledge/blob/76882799c7614eeb9307687bceab33896a79bb13/research/CONTENT-AUTHORING-EVIDENCE-2026-07-19.md",
      "accessed": "2026-07-20",
      "version": "Rapid evidence synthesis at repository commit 76882799c7614eeb9307687bceab33896a79bb13",
      "locator": "Sections 4, 6 through 9, and 12; Method and limitations",
      "license": "CC BY 4.0",
      "archivedUrl": null,
      "uses": [
        {
          "usageType": "factual-reference",
          "rightsBasis": "facts-only-original-expression",
          "rightsBasisEvidence": "Only synthesis conclusions and stated limitations were used; lesson structure, cases, explanations, and feedback were created independently."
        }
      ],
      "agentAccess": {
        "status": "checked-no-agent-restriction-found",
        "termsUrl": "https://embeddedknowledge.io/content-license.txt",
        "checked": "2026-07-20",
        "notes": "Public repository-owned research source. Project authoring instructions direct agent use of this file, and no access control or agent-ingestion restriction was found."
      }
    },
    {
      "id": "source-premed-graph",
      "type": "dataset",
      "title": "EmbeddedKnowledge Premed knowledge graph",
      "creators": [
        "EmbeddedKnowledge"
      ],
      "publisher": "EmbeddedKnowledge",
      "issued": "2026-07-19",
      "url": "https://github.com/VSBDev/EmbeddedKnowledge/blob/76882799c7614eeb9307687bceab33896a79bb13/site/data/premed-graph.json",
      "accessed": "2026-07-20",
      "version": "Schema version 1 at repository commit 76882799c7614eeb9307687bceab33896a79bb13",
      "locator": "Nodes topic-orientation-map-and-pathways, topic-orientation-diagnostic-baseline, and topic-orientation-mastery-and-retrieval; their prerequisite links",
      "license": "CC BY 4.0",
      "archivedUrl": null,
      "uses": [
        {
          "usageType": "factual-reference",
          "rightsBasis": "facts-only-original-expression",
          "rightsBasisEvidence": "Only the assigned node identities and individual prerequisite relationships were consulted; no database extraction, copied arrangement, or redistributed dataset is included."
        }
      ],
      "agentAccess": {
        "status": "checked-no-agent-restriction-found",
        "termsUrl": "https://embeddedknowledge.io/content-license.txt",
        "checked": "2026-07-20",
        "notes": "Public repository-owned curriculum data exposed as an agent discovery surface; no access control or agent-ingestion restriction was found for this bounded factual lookup."
      }
    }
  ]
}
