{
  "schemaVersion": 2,
  "format": "embeddedknowledge-references-v2",
  "lessonId": "PREM-SCI-002",
  "lessonVersion": "0.2.0",
  "sources": [
    {
      "id": "source-usgs-rigor",
      "type": "primary-research",
      "title": "Increased scientific rigor will improve reliability of research and effectiveness of management",
      "creators": [
        "Sarah N. Sells",
        "Sarah B. Bassing",
        "Kristin J. Barker",
        "Shannon C. Forshee",
        "Allison Keever",
        "James W. Goerz",
        "Michael S. Mitchell"
      ],
      "publisher": "Journal of Wildlife Management; metadata and abstract hosted by the U.S. Geological Survey",
      "issued": "2018-01-14",
      "url": "https://pubs.usgs.gov/publication/70196876",
      "accessed": "2026-07-20",
      "version": "Volume 82, issue 3, pages 485\u2013494; DOI 10.1002/jwmg.21413",
      "locator": "USGS publication page, abstract, especially the six-part question\u2013hypothesis\u2013prediction\u2013data\u2013evaluation\u2013inference sequence and the statement on reducing plausible explanations",
      "license": "Publisher article rights are not asserted. The USGS metadata and abstract were used only as facts; no source expression or full text is reused.",
      "archivedUrl": null,
      "uses": [
        {
          "usageType": "factual-reference",
          "rightsBasis": "facts-only-original-expression",
          "rightsBasisEvidence": "The lesson independently expresses the logical roles of questions, hypotheses, predictions, evidence comparison, and inference. All cases, values, tables, sequences of prompts, assessment items, and learner-facing wording are original. The publisher page and article full text were not processed."
        }
      ],
      "agentAccess": {
        "status": "checked-no-agent-restriction-found",
        "termsUrl": "https://www.usgs.gov/information-policies-and-instructions/copyrights-and-credits",
        "checked": "2026-07-20",
        "notes": "Before substantive access, the USGS copyrights-and-credits route was inspected. It describes USGS-authored or produced information as generally public domain and showed no term prohibiting this limited agent reading. The public USGS publication metadata-and-abstract page was then read without login, bypass, bulk collection, DOI redirection, or access to publisher-hosted full text. This is a dated access observation, not a warranty about third-party article rights."
      }
    },
    {
      "id": "source-epa-causal-assessment",
      "type": "guideline",
      "title": "About Causal Assessment",
      "creators": [
        "U.S. Environmental Protection Agency"
      ],
      "publisher": "U.S. Environmental Protection Agency",
      "issued": null,
      "url": "https://www.epa.gov/caddis/about-causal-assessment",
      "accessed": "2026-07-20",
      "version": "CADDIS Volume 1 web guidance as accessed 2026-07-20",
      "locator": "An Approach to Causal Inference: Comparison of Candidate Causes, Rejection, Synthesis of Evidence; Causal Concepts: Predictive Performance",
      "license": "U.S. federal government website material, used only as a factual and methodological reference. No wording, quotation, figure, table, example, or incorporated third-party material is reused.",
      "archivedUrl": null,
      "uses": [
        {
          "usageType": "factual-reference",
          "rightsBasis": "facts-only-original-expression",
          "rightsBasisEvidence": "The lesson independently synthesizes the page's methodological points about specifying predictions before relevant observations, comparing alternate candidate explanations, and not treating a single result as causal proof. The lesson does not reproduce the page's wording, historical quotations, environmental examples, framework, scoring system, figures, or tables."
        }
      ],
      "agentAccess": {
        "status": "checked-no-agent-restriction-found",
        "termsUrl": "https://www.epa.gov/web-policies-and-procedures/epa-disclaimers",
        "checked": "2026-07-20",
        "notes": "Before substantive access, the EPA disclaimer and copyright route was inspected. No term prohibiting this limited agent reading of the public page was found. The public HTTPS causal-assessment page was then read without login, bypass, download, or bulk collection. This is a dated observation and does not extend to separately credited third-party material."
      }
    }
  ]
}
