{
  "schemaVersion": 2,
  "format": "embeddedknowledge-references-v2",
  "lessonId": "PREM-SCI-004",
  "lessonVersion": "0.2.0",
  "sources": [
    {
      "id": "source-study-design-overview",
      "type": "review",
      "title": "Study designs: Part 1 \u2013 An overview and classification",
      "creators": [
        "Priya Ranganathan",
        "Rakesh Aggarwal"
      ],
      "publisher": "Perspectives in Clinical Research",
      "issued": "2018-10",
      "url": "https://pmc.ncbi.nlm.nih.gov/articles/PMC6176693/",
      "accessed": "2026-07-20",
      "version": "Volume 9, issue 4; DOI 10.4103/picr.PICR_124_18",
      "locator": "Classification by direction of inquiry; prospective versus retrospective designs; three-point classification algorithm",
      "license": "CC BY-NC-SA",
      "archivedUrl": null,
      "uses": [
        {
          "usageType": "factual-reference",
          "rightsBasis": "facts-only-original-expression",
          "rightsBasisEvidence": "Used only to verify introductory design distinctions. Lesson prose, cases, tables, sequence, prompts, and answer logic are independently created; no source expression or figure is reused."
        }
      ],
      "agentAccess": {
        "status": "checked-no-agent-restriction-found",
        "termsUrl": "https://www.ncbi.nlm.nih.gov/home/about/policies/",
        "checked": "2026-07-20",
        "notes": "Before article access, the NCBI policies and PMC robots route were checked. PMC robots permits article and API paths, and the policy states general website and scripting conditions without an agent-ingestion prohibition. The source was read through one public NCBI BioC API request without login, paywall, or access-control bypass."
      }
    },
    {
      "id": "source-clinical-design-essentials",
      "type": "review",
      "title": "Clinical research study designs: The essentials",
      "creators": [
        "Ambika G. Chidambaram",
        "Maureen Josephson"
      ],
      "publisher": "Pediatric Investigation",
      "issued": "2019-12-21",
      "url": "https://pmc.ncbi.nlm.nih.gov/articles/PMC7331444/",
      "accessed": "2026-07-20",
      "version": "Volume 3, issue 4; DOI 10.1002/ped4.12166",
      "locator": "Sections Cross-sectional study, Case-control study, Cohort study, Crossover study design, and Randomization",
      "license": "CC BY-NC-ND",
      "archivedUrl": null,
      "uses": [
        {
          "usageType": "factual-reference",
          "rightsBasis": "facts-only-original-expression",
          "rightsBasisEvidence": "Used only to verify design purposes and limits, including prevalence, uncommon outcomes, cohort timing, crossover structure, and time-related threats. No wording, example, table, figure, or protected organization is reused."
        }
      ],
      "agentAccess": {
        "status": "checked-no-agent-restriction-found",
        "termsUrl": "https://www.ncbi.nlm.nih.gov/home/about/policies/",
        "checked": "2026-07-20",
        "notes": "Before article access, the NCBI policies and PMC robots route were checked. PMC robots permits article and API paths, and the policy states general website and scripting conditions without an agent-ingestion prohibition. The source was read through one public NCBI BioC API request without login, paywall, or access-control bypass."
      }
    },
    {
      "id": "source-observational-designs",
      "type": "review",
      "title": "Observational Studies: Cohort and Case-Control Studies",
      "creators": [
        "Jae W. Song",
        "Kevin C. Chung"
      ],
      "publisher": "Plastic and Reconstructive Surgery",
      "issued": "2010-12",
      "url": "https://pmc.ncbi.nlm.nih.gov/articles/PMC2998589/",
      "accessed": "2026-07-20",
      "version": "Author manuscript; volume 126, issue 6; DOI 10.1097/PRS.0b013e3181f44abc",
      "locator": "Case-Control Study; Selection of Controls; Assessment of Exposure",
      "license": null,
      "archivedUrl": null,
      "uses": [
        {
          "usageType": "factual-reference",
          "rightsBasis": "facts-only-original-expression",
          "rightsBasisEvidence": "Used only to verify outcome-first selection, same-source-population controls, comparable exposure ascertainment, and uncommon-outcome use. No source wording, example, table, or figure is reused."
        }
      ],
      "agentAccess": {
        "status": "checked-no-agent-restriction-found",
        "termsUrl": "https://www.ncbi.nlm.nih.gov/home/about/policies/",
        "checked": "2026-07-20",
        "notes": "Before article access, the NCBI policies and PMC robots route were checked. PMC robots permits article and API paths, and the policy states general website and scripting conditions without an agent-ingestion prohibition. The source was read through one public NCBI BioC API request without login, paywall, or access-control bypass."
      }
    },
    {
      "id": "source-natural-experiments",
      "type": "review",
      "title": "Natural Experiments: An Overview of Methods, Approaches, and Contributions to Public Health Intervention Research",
      "creators": [
        "Peter Craig",
        "Srinivasa Vittal Katikireddi",
        "Alastair Leyland",
        "Frank Popham"
      ],
      "publisher": "Annual Review of Public Health",
      "issued": "2017-03-20",
      "url": "https://pmc.ncbi.nlm.nih.gov/articles/PMC6485604/",
      "accessed": "2026-07-20",
      "version": "Volume 38; DOI 10.1146/annurev-publhealth-031816-044327",
      "locator": "Introduction; Causal Inference in Trials and Observational Studies; Table 1",
      "license": "CC BY-SA",
      "archivedUrl": null,
      "uses": [
        {
          "usageType": "factual-reference",
          "rightsBasis": "facts-only-original-expression",
          "rightsBasisEvidence": "Used only to verify researcher-controlled random assignment, externally created exposure, selective-exposure limits, and calibrated inference. No source wording, example, figure, or table is reused."
        }
      ],
      "agentAccess": {
        "status": "checked-no-agent-restriction-found",
        "termsUrl": "https://www.ncbi.nlm.nih.gov/home/about/policies/",
        "checked": "2026-07-20",
        "notes": "Before article access, the NCBI policies and PMC robots route were checked. PMC robots permits article and API paths, and the policy states general website and scripting conditions without an agent-ingestion prohibition. The source was read through one public NCBI BioC API request without login, paywall, or access-control bypass."
      }
    }
  ]
}
